{"$schema":"https://json-schema.org/draft/2020-12/schema","additionalProperties":false,"properties":{"artifact":{"minLength":1,"type":"string"},"artifact_sha256":{"type":"string"},"attachments":{"items":{"additionalProperties":false,"properties":{"path":{"type":"string"},"sha256":{"pattern":"^[0-9a-f]{64}$","type":"string"}},"required":["path","sha256"],"type":"object"},"type":"array"},"code_sha256":{"minLength":1,"type":"string"},"comparison":{"type":"object"},"compiler":{"additionalProperties":false,"properties":{"diagnostic":{"type":["string","null"]},"status":{"enum":["not_compiled","compiled","error","blocked","unknown"]}},"required":["status","diagnostic"],"type":"object"},"context_hash":{"type":"string"},"data":{"type":"object"},"date":{"minLength":1,"type":"string"},"definition_hash":{"minLength":1,"type":"string"},"definition_id":{"minLength":1,"type":"string"},"environment":{"additionalProperties":false,"properties":{"build":{"minLength":1,"type":"string"},"implementation":{"minLength":1,"type":"string"},"mode":{"minLength":1,"type":"string"}},"required":["implementation","build","mode"],"type":"object"},"language_version":{"type":"integer"},"parameters":{"type":"object"},"run_id":{"minLength":1,"type":"string"},"runtime":{"additionalProperties":false,"properties":{"observed":{"type":["object","array","string","number","integer","boolean","null"]},"reason":{"type":["string","null"]},"status":{"enum":["not_executed","executed","error","blocked","unknown"]}},"required":["status","observed","reason"],"type":"object"},"screenshot":{"type":"string"}},"required":["run_id","definition_id","definition_hash","code_sha256","language_version","date","environment","parameters","data","compiler","runtime","artifact"],"type":"object"}
