{"artifact":"spec/run-artifacts/method-overload.json","attachments":[{"path":"spec/run-artifacts/method-overload.jpg","sha256":"ef894e13eb3d201cb1890184cd7f73dc2645cf8e219dfd2dd3d066e018fd38ae"}],"code_sha256":"47cdac3c8f2563824d70f2fe1f7e269b5cc045f74ea195adf5802451119d2064","comparison":{"oracle_origin":"independent documentation expectation; not derived from consumer output","passed":true,"scope":"latest confirmed sample"},"compiler":{"diagnostic":null,"status":"compiled"},"context_hash":"cbcf0b1c7f6da72b888e476c57cbbf12b18fc69df5508934bf2a7f04ae4b8a93","data":{"dataset_policy":"Available chart history; full vendor market data excluded from export. Exact observed outputs and aggregates retained; reproduction needs the same vendor dataset.","last_bar_time":1792422000000,"session":"regular trading hours","symbol":"RUS:USDRUB_TOM","timeframe":"60","timezone":"UTC"},"date":"2026-10-20T00:12:34.021Z","definition_hash":"978c047e5285f981337157ae01fedd528505ba7f55ac23274c42cdf2fc6e6c13","definition_id":"probe.audit.method-overload","environment":{"build":"web 2026-10-20; vendor build identifier not exposed","implementation":"TradingView Pine Editor","mode":"historical confirmed; market closed"},"language_version":6,"parameters":{"chart_type":"standard candles","market":"closed","script_inputs":"defaults"},"run_id":"run.tradingview.method-overload.20261020","runtime":{"observed":{"table":"bool / float"},"reason":null,"status":"executed"},"screenshot":"spec/run-artifacts/method-overload.jpg"}
