{"artifact":"spec/run-artifacts/audit6091-declared-float.json","code_sha256":"da61ddecef20029024ace092e24b21dbb0b9c5208b55b569afbcbb922ac902b3","comparison":{"origin":"own_consumer_regression","passed":true},"compiler":{"diagnostic":null,"status":"compiled"},"context_hash":"502134098385be64e8f2bd5391d430842af3d72e26b09ed412d2906777a5cdf8","data":{"fixture":"spec/fixtures/context.json","sha256":"e9d64a394431632ec0723f7a830b36fa2304d91c0ce5c02cbe498f42005c96b6"},"date":"2026-10-20T17:01:14.289374+00:00","definition_hash":"ba1e88715b423a3a392fabf6e8d67a042cdf1471f42f2e503240bc981edfb696","definition_id":"probe.audit6091.declared-float","environment":{"build":"4e6babf3f2cfe4b4791e2c001ac5afec0aae4da962aeb3ea45088ccc0e0acbd4","implementation":"Pine Wiki offline consumer regression","mode":"own synthetic historical fixture"},"language_version":6,"parameters":{},"run_id":"run.consumer.audit6091.declared-float.20261020","runtime":{"observed":{"plots":{"value":[2.5,2.5,2.5,2.5]}},"reason":null,"status":"executed"}}
