{"artifact":"spec/run-artifacts/rsi-tolerance.json","attachments":[{"path":"spec/run-artifacts/rsi-tolerance.jpg","sha256":"6b0ad975ed49cced2fad6f3311fd3e77e4571cf9ea5ec4a4f3077f5f69b7c4b6"},{"path":"spec/run-artifacts/rsi-tolerance.txt","sha256":"b1d852ac622548c7c42013801792c314f272084bf0ebe01cdb123384e050977f"},{"path":"spec/run-artifacts/rsi-tolerance.pine","sha256":"bf1a09e7ec4975c505471df66462024e314d05b9be972bb8d481648e52da9797"}],"code_sha256":"bf1a09e7ec4975c505471df66462024e314d05b9be972bb8d481648e52da9797","comparison":{"oracle_origin":"independent documentation expectation; not derived from consumer output","passed":true,"scope":"whole loaded range; exact in-Pine comparison maximum <= 1e-10, independent of display rounding"},"compiler":{"diagnostic":null,"status":"compiled"},"context_hash":"b50c953d64670dc08c23d05eb7d86010d4f519fa0549d041652b5ab709b58e04","data":{"dataset_policy":"Available chart history; full vendor market data excluded from export. Exact observed outputs and aggregates retained; reproduction needs the same vendor dataset.","defined_bars":12900,"first_defined_time":1609747200000,"last_bar_time":1792422000000,"session":"regular trading hours","symbol":"RUS:USDRUB_TOM","timeframe":"60","timezone":"UTC"},"date":"2026-10-20T00:22:09.096Z","definition_hash":"c799eeb39bbd7b05fd79fbdbf9b7e5a8e30f9f6ddcc5bc087ba237d9311d30e7","definition_id":"probe.audit.rsi-tolerance","environment":{"build":"web 2026-10-20; vendor build identifier not exposed","implementation":"TradingView Pine Editor","mode":"historical confirmed; market closed"},"language_version":4,"parameters":{"chart_type":"standard candles","market":"closed","script_inputs":"defaults"},"run_id":"run.tradingview.rsi-tolerance.20261020","runtime":{"observed":{"defined_bars":12900,"first_defined_time":1609747200000,"last_time":1792422000000,"maximum_within_1e_10":true,"na_mismatches":0,"predicate_plot":1},"reason":null,"status":"executed"},"screenshot":"spec/run-artifacts/rsi-tolerance.jpg"}
