{"artifact":"spec/run-artifacts/loop-return.json","attachments":[{"path":"spec/run-artifacts/loop-return.jpg","sha256":"d937bdddc541b04333a3e0f211eb42e72e971f1f94646106d7c295b3e8ac718e"}],"code_sha256":"f7a261d99389e471025fd60b3c8abf8ad4fa4134d2f2b36cc6b5e55b41d3d6d4","comparison":{"oracle_origin":"independent documentation expectation; not derived from consumer output","passed":true,"scope":"latest confirmed sample"},"compiler":{"diagnostic":null,"status":"compiled"},"context_hash":"cbcf0b1c7f6da72b888e476c57cbbf12b18fc69df5508934bf2a7f04ae4b8a93","data":{"dataset_policy":"Available chart history; full vendor market data excluded from export. Exact observed outputs and aggregates retained; reproduction needs the same vendor dataset.","last_bar_time":1792422000000,"session":"regular trading hours","symbol":"RUS:USDRUB_TOM","timeframe":"60","timezone":"UTC"},"date":"2026-10-20T00:12:20.601Z","definition_hash":"8645b7c2c8f6b50ddf348e57bbbb832e947f20047e15b289ce760c301d3915db","definition_id":"probe.audit.loop-return","environment":{"build":"web 2026-10-20; vendor build identifier not exposed","implementation":"TradingView Pine Editor","mode":"historical confirmed; market closed"},"language_version":6,"parameters":{"chart_type":"standard candles","market":"closed","script_inputs":"defaults"},"run_id":"run.tradingview.loop-return.20261020","runtime":{"observed":{"result":30},"reason":null,"status":"executed"},"screenshot":"spec/run-artifacts/loop-return.jpg"}
