{"artifact":"spec/run-artifacts/audit6091-series-length.json","code_sha256":"aa95db410d7b3780755bff5d4fd38425420f39cf64075e31d540fd623adde2c9","comparison":{"diagnostic":{"category":"LANGUAGE_INVALID","phase":"compile","rule_id":"rule.types","source_span":{"column":6,"line":6}},"origin":"own_consumer_regression","passed":true},"compiler":{"diagnostic":"Argument qualifier violates at_most simple: length","status":"error"},"context_hash":"502134098385be64e8f2bd5391d430842af3d72e26b09ed412d2906777a5cdf8","data":{"fixture":"spec/fixtures/context.json","sha256":"e9d64a394431632ec0723f7a830b36fa2304d91c0ce5c02cbe498f42005c96b6"},"date":"2026-10-20T17:01:13.932689+00:00","definition_hash":"5c139254989e3ab46c8f4431fc510eabf75cac6f0281259711b363888ed52ce7","definition_id":"probe.audit6091.series-length","environment":{"build":"4e6babf3f2cfe4b4791e2c001ac5afec0aae4da962aeb3ea45088ccc0e0acbd4","implementation":"Pine Wiki offline consumer regression","mode":"own synthetic historical fixture"},"language_version":6,"parameters":{},"run_id":"run.consumer.audit6091.series-length.20261020","runtime":{"observed":null,"reason":null,"status":"not_executed"}}
