{"artifact":"spec/run-artifacts/lookahead-6-full.json","attachments":[{"path":"spec/run-artifacts/lookahead-6-full.jpg","sha256":"257ad940f825ae9487e78d90f77b424365b529f9d612c4e4a2350df6ea9229aa"},{"path":"spec/run-artifacts/lookahead-6-full.txt","sha256":"0dde50586d2a112d85bb7b67900f3de7478aab2c281f90b7e75fc795cb776647"},{"path":"spec/run-artifacts/lookahead-6-full.pine","sha256":"3a3c8434948aa8655d4550a69fd2263189e3a3f6526845733c30f8057e51f299"}],"code_sha256":"3a3c8434948aa8655d4550a69fd2263189e3a3f6526845733c30f8057e51f299","comparison":{"oracle_origin":"independent documentation expectation; not derived from consumer output","passed":null,"scope":"Formatted log aggregate; exact equality is proved by a separate instrumented definition."},"compiler":{"diagnostic":null,"status":"compiled"},"context_hash":"494ec65426b6ca7204babd8eb12eb95fe3d4897736518b9275516f99b77b14e0","data":{"bars":12901,"dataset_policy":"Available chart history; full vendor market data excluded from export. Exact observed outputs and aggregates retained; reproduction needs the same vendor dataset.","first_bar_time":1609743600000,"first_defined_time":1609743600000,"last_bar_time":1792422000000,"session":"regular trading hours","symbol":"RUS:USDRUB_TOM","timeframe":"60","timezone":"UTC"},"date":"2026-10-20T00:13:35Z","definition_hash":"298e633abd3b249475c51bd267fd433cc49be213df3793ea6c94d5ba8e283fbf","definition_id":"probe.audit.lookahead-6-full","environment":{"build":"web 2026-10-20; vendor build identifier not exposed","implementation":"TradingView Pine Editor","mode":"historical confirmed; market closed"},"language_version":6,"parameters":{"chart_type":"standard candles","market":"closed","script_inputs":"defaults"},"run_id":"run.tradingview.lookahead-6-full.20261020","runtime":{"observed":{"defined_bars":12901,"first_defined_time":1609743600000,"last_time":1792422000000,"max_abs_error":0,"na_mismatches":0},"reason":null,"status":"executed"},"screenshot":"spec/run-artifacts/lookahead-6-full.jpg"}
