{"artifact":"spec/run-artifacts/once-confirmed.json","attachments":[{"path":"spec/run-artifacts/once-confirmed.jpg","sha256":"2e22a6db599cfc6e508abf532b12bdafbb9b62739bfee1a970cb79c2f9c769e2"}],"code_sha256":"384bdcc841869a0d510a24be3d4a9fe6d3978b55e3f29bf6025f1b7f09afd6e2","comparison":{"oracle_origin":"independent documentation expectation; not derived from consumer output","passed":true,"scope":"latest confirmed sample"},"compiler":{"diagnostic":null,"status":"compiled"},"context_hash":"cbcf0b1c7f6da72b888e476c57cbbf12b18fc69df5508934bf2a7f04ae4b8a93","data":{"dataset_policy":"Available chart history; full vendor market data excluded from export. Exact observed outputs and aggregates retained; reproduction needs the same vendor dataset.","last_bar_time":1792422000000,"session":"regular trading hours","symbol":"RUS:USDRUB_TOM","timeframe":"60","timezone":"UTC"},"date":"2026-10-20T00:13:39.999Z","definition_hash":"055ce73f7de8845e17c165b7de0b2c2c71774a4948b570fca237fba64358e47c","definition_id":"probe.audit.once-confirmed","environment":{"build":"web 2026-10-20; vendor build identifier not exposed","implementation":"TradingView Pine Editor","mode":"historical confirmed; market closed"},"language_version":6,"parameters":{"chart_type":"standard candles","market":"closed","script_inputs":"defaults"},"run_id":"run.tradingview.once-confirmed.20261020","runtime":{"observed":{"count":1,"limitation":"historical only; realtime rollback not exercised"},"reason":null,"status":"executed"},"screenshot":"spec/run-artifacts/once-confirmed.jpg"}
