{"artifact":"spec/run-artifacts/scope.json","attachments":[{"path":"spec/run-artifacts/scope.jpg","sha256":"046950a9e2141a82ecb1836bcbcddbe16f1736c6a8f3237366735117707a38fd"}],"code_sha256":"d02fe6d5292ed4db1d6b82d33d20a8f209917681e26dcf50d36fc51044f5df97","comparison":{"oracle_origin":"independent documentation expectation; not derived from consumer output","passed":null,"scope":"latest confirmed sample"},"compiler":{"diagnostic":null,"status":"compiled"},"context_hash":"cbcf0b1c7f6da72b888e476c57cbbf12b18fc69df5508934bf2a7f04ae4b8a93","data":{"dataset_policy":"Available chart history; full vendor market data excluded from export. Exact observed outputs and aggregates retained; reproduction needs the same vendor dataset.","last_bar_time":1792422000000,"session":"regular trading hours","symbol":"RUS:USDRUB_TOM","timeframe":"60","timezone":"UTC"},"date":"2026-10-20T00:12:04.624Z","definition_hash":"3c83d44e4a6ec1d7939384176e254219badf5614b7bd039a56487ce2e46bae80","definition_id":"probe.audit.scope","environment":{"build":"web 2026-10-20; vendor build identifier not exposed","implementation":"TradingView Pine Editor","mode":"historical confirmed; market closed"},"language_version":6,"parameters":{"chart_type":"standard candles","market":"closed","script_inputs":"defaults"},"run_id":"run.tradingview.scope.20261020","runtime":{"observed":{"limitation":"latest bar has open=close; bullish branch not separately observed","outer":83.455,"reassigned":83.455},"reason":null,"status":"executed"},"screenshot":"spec/run-artifacts/scope.jpg"}
