{"artifact":"spec/run-artifacts/lookahead-5-exact.json","attachments":[{"path":"spec/run-artifacts/lookahead-5-exact.jpg","sha256":"b9b63772fb4d76536f626ffb7e710e9df553da4807037b53168064cab62512e9"},{"path":"spec/run-artifacts/lookahead-5-exact.txt","sha256":"8b5b81b001f2d8ba892f16e1d41b4749e8b949d15e868ec959f2afe4af7b5971"},{"path":"spec/run-artifacts/lookahead-5-exact.pine","sha256":"352283d0e9c22356a95efb141da78032683d92c4669e31f7e3ba4fdd7b374796"}],"code_sha256":"352283d0e9c22356a95efb141da78032683d92c4669e31f7e3ba4fdd7b374796","comparison":{"oracle_origin":"independent documentation expectation; not derived from consumer output","passed":true,"scope":"whole loaded range; in-Pine exact predicate maxError == 0.0, independent of number formatting; NA-mask mismatch count 0"},"compiler":{"diagnostic":null,"status":"compiled"},"context_hash":"494ec65426b6ca7204babd8eb12eb95fe3d4897736518b9275516f99b77b14e0","data":{"bars":12901,"dataset_policy":"Available chart history; full vendor market data excluded from export. Exact observed outputs and aggregates retained; reproduction needs the same vendor dataset.","first_bar_time":1609743600000,"first_defined_time":1609743600000,"last_bar_time":1792422000000,"session":"regular trading hours","symbol":"RUS:USDRUB_TOM","timeframe":"60","timezone":"UTC"},"date":"2026-10-20T00:31:57.382Z","definition_hash":"c0599cac6615bb4eb5f0bf4d99319b16a4692b4387b72e35e4b033ee1dcea63d","definition_id":"probe.audit.lookahead-5-exact","environment":{"build":"web 2026-10-20; vendor build identifier not exposed","implementation":"TradingView Pine Editor","mode":"historical confirmed; market closed"},"language_version":5,"parameters":{"chart_type":"standard candles","market":"closed","script_inputs":"defaults"},"run_id":"run.tradingview.lookahead-5-exact.20261020","runtime":{"observed":{"defined_bars":12901,"exact_equality":true,"first_defined_time":1609743600000,"last_time":1792422000000,"na_mismatches":0,"predicate_plot":1},"reason":null,"status":"executed"},"screenshot":"spec/run-artifacts/lookahead-5-exact.jpg"}
