{"artifact":"spec/run-artifacts/audit6091-literal-history.json","code_sha256":"f6df14af529a30d317c17ec0e58e12598e8fe38f8d4ffbba6f845e3a9f1b25a7","comparison":{"diagnostic":{"category":"LANGUAGE_INVALID","phase":"compile","rule_id":"rule.history","source_span":{"column":6,"line":3}},"origin":"own_consumer_regression","passed":true},"compiler":{"diagnostic":"History of literal values is forbidden in v6","status":"error"},"context_hash":"502134098385be64e8f2bd5391d430842af3d72e26b09ed412d2906777a5cdf8","data":{"fixture":"spec/fixtures/context.json","sha256":"e9d64a394431632ec0723f7a830b36fa2304d91c0ce5c02cbe498f42005c96b6"},"date":"2026-10-20T17:01:13.843159+00:00","definition_hash":"4235ba042a0538fb277260ea1c291b175a6cee3837528ebcc49c54d6dd5ce717","definition_id":"probe.audit6091.literal-history","environment":{"build":"4e6babf3f2cfe4b4791e2c001ac5afec0aae4da962aeb3ea45088ccc0e0acbd4","implementation":"Pine Wiki offline consumer regression","mode":"own synthetic historical fixture"},"language_version":6,"parameters":{},"run_id":"run.consumer.audit6091.literal-history.20261020","runtime":{"observed":null,"reason":null,"status":"not_executed"}}
