{"artifact":"spec/run-artifacts/audit6091-bool-ordering.json","code_sha256":"d58a18399bded47c0cb0451ec7e385138041f203f420c59e8f9ecf6478a73d14","comparison":{"diagnostic":{"category":"LANGUAGE_INVALID","phase":"compile","rule_id":"rule.types","source_span":{"column":11,"line":3}},"origin":"own_consumer_regression","passed":true},"compiler":{"diagnostic":"Ordering requires numeric operands","status":"error"},"context_hash":"502134098385be64e8f2bd5391d430842af3d72e26b09ed412d2906777a5cdf8","data":{"fixture":"spec/fixtures/context.json","sha256":"e9d64a394431632ec0723f7a830b36fa2304d91c0ce5c02cbe498f42005c96b6"},"date":"2026-10-20T17:01:13.861461+00:00","definition_hash":"0a7f66f4d831aa9789668e95d49b7d645d8d4958ce84182033e6ec9851adfe4e","definition_id":"probe.audit6091.bool-ordering","environment":{"build":"4e6babf3f2cfe4b4791e2c001ac5afec0aae4da962aeb3ea45088ccc0e0acbd4","implementation":"Pine Wiki offline consumer regression","mode":"own synthetic historical fixture"},"language_version":6,"parameters":{},"run_id":"run.consumer.audit6091.bool-ordering.20261020","runtime":{"observed":null,"reason":null,"status":"not_executed"}}
