{"artifact":"spec/run-artifacts/rsi-contracts.json","attachments":[{"path":"spec/run-artifacts/rsi-contracts.jpg","sha256":"26e1a97dff17a9893009f2168da731176bd5c74bd8da2c42ba9f647b56806c81"}],"code_sha256":"5ee958681ed68546a1028c36646d2b7efb7ee103ca367b30344d9fa11d3e1d3a","comparison":{"oracle_origin":"independent documentation expectation; not derived from consumer output","passed":null,"scope":"Latest displayed sample; no exact tolerance proof without the separate aggregate predicate."},"compiler":{"diagnostic":null,"status":"compiled"},"context_hash":"cbcf0b1c7f6da72b888e476c57cbbf12b18fc69df5508934bf2a7f04ae4b8a93","data":{"dataset_policy":"Available chart history; full vendor market data excluded from export. Exact observed outputs and aggregates retained; reproduction needs the same vendor dataset.","last_bar_time":1792422000000,"session":"regular trading hours","symbol":"RUS:USDRUB_TOM","timeframe":"60","timezone":"UTC"},"date":"2026-10-20T00:12:36.320Z","definition_hash":"b1efac4b46f492241fe8598873f137687e394c074058224917a3bfa629c7a944","definition_id":"probe.audit.rsi-contracts","environment":{"build":"web 2026-10-20; vendor build identifier not exposed","implementation":"TradingView Pine Editor","mode":"historical confirmed; market closed"},"language_version":4,"parameters":{"chart_type":"standard candles","market":"closed","script_inputs":"defaults"},"run_id":"run.tradingview.rsi-contracts.20261020","runtime":{"observed":{"ordinary_rsi_display":46.8186,"ratio_difference_display":0},"reason":null,"status":"executed"},"screenshot":"spec/run-artifacts/rsi-contracts.jpg"}
