{"artifact":"spec/run-artifacts/audit6091-annotated-reassignment.json","code_sha256":"61e944c2bd0181d0fa9ddcb27dbf64e031b2e6fa55d3c05a35291ed97f660f2b","comparison":{"diagnostic":{"category":"LANGUAGE_INVALID","phase":"parse","rule_id":"rule.grammar","source_span":{"column":1,"line":4}},"origin":"own_consumer_regression","passed":true},"compiler":{"diagnostic":"Reassignment cannot declare a type or mode","status":"error"},"context_hash":"502134098385be64e8f2bd5391d430842af3d72e26b09ed412d2906777a5cdf8","data":{"fixture":"spec/fixtures/context.json","sha256":"e9d64a394431632ec0723f7a830b36fa2304d91c0ce5c02cbe498f42005c96b6"},"date":"2026-10-20T17:01:13.896872+00:00","definition_hash":"6b011059caf42553d5f5087613bd38f480dfe4c804bdabfe028cf5ae21d98820","definition_id":"probe.audit6091.annotated-reassignment","environment":{"build":"4e6babf3f2cfe4b4791e2c001ac5afec0aae4da962aeb3ea45088ccc0e0acbd4","implementation":"Pine Wiki offline consumer regression","mode":"own synthetic historical fixture"},"language_version":6,"parameters":{},"run_id":"run.consumer.audit6091.annotated-reassignment.20261020","runtime":{"observed":null,"reason":null,"status":"not_executed"}}
