{"artifact":"spec/run-artifacts/audit6091-request-capture.json","code_sha256":"55c85f5d932d034fd7cbdefa4b5bbccaa9277f6d55c8dac3fb2f9d20db0768c6","comparison":{"origin":"own_consumer_regression","passed":true},"compiler":{"diagnostic":null,"status":"compiled"},"context_hash":"502134098385be64e8f2bd5391d430842af3d72e26b09ed412d2906777a5cdf8","data":{"fixture":"spec/fixtures/context.json","sha256":"e9d64a394431632ec0723f7a830b36fa2304d91c0ce5c02cbe498f42005c96b6"},"date":"2026-10-20T17:01:14.348665+00:00","definition_hash":"46ae3ef92b51b09684406695c82fa2ddfafafc8c97917233b54734aa4617181b","definition_id":"probe.audit6091.request-capture","environment":{"build":"4e6babf3f2cfe4b4791e2c001ac5afec0aae4da962aeb3ea45088ccc0e0acbd4","implementation":"Pine Wiki offline consumer regression","mode":"own synthetic historical fixture"},"language_version":6,"parameters":{},"run_id":"run.consumer.audit6091.request-capture.20261020","runtime":{"observed":{"plots":{"value":[null,20.0,20.0,30.0]}},"reason":null,"status":"executed"}}
