{"artifact":"spec/run-artifacts/overload.json","attachments":[{"path":"spec/run-artifacts/overload.jpg","sha256":"4c3cdd86a3094b0a9b39c727f5fa1b4aaac7716c5f684c016158721737b51b09"}],"code_sha256":"4d684431a1ae63f80c3ce88e8a9217e39d58f4488b06d3e4de32ad3f24c6f4d2","comparison":{"oracle_origin":"independent documentation expectation; not derived from consumer output","passed":true,"scope":"latest confirmed sample"},"compiler":{"diagnostic":null,"status":"compiled"},"context_hash":"cbcf0b1c7f6da72b888e476c57cbbf12b18fc69df5508934bf2a7f04ae4b8a93","data":{"dataset_policy":"Available chart history; full vendor market data excluded from export. Exact observed outputs and aggregates retained; reproduction needs the same vendor dataset.","last_bar_time":1792422000000,"session":"regular trading hours","symbol":"RUS:USDRUB_TOM","timeframe":"60","timezone":"UTC"},"date":"2026-10-20T00:12:32.207Z","definition_hash":"27d51e24b0bbb7684cc931d3387b46e17b9606afcd1ec21ce3d97ec6bc0bcdb4","definition_id":"probe.audit.overload","environment":{"build":"web 2026-10-20; vendor build identifier not exposed","implementation":"TradingView Pine Editor","mode":"historical confirmed; market closed"},"language_version":6,"parameters":{"chart_type":"standard candles","market":"closed","script_inputs":"defaults"},"run_id":"run.tradingview.overload.20261020","runtime":{"observed":{"bool_plot":1,"float_result":-83.455},"reason":null,"status":"executed"},"screenshot":"spec/run-artifacts/overload.jpg"}
