{"artifact":"spec/run-artifacts/line-wrapping.json","attachments":[{"path":"spec/run-artifacts/line-wrapping.jpg","sha256":"17beb6e74edf5cb1c370510490a45cd578ac7e49f9ff6c6f8354254722961218"}],"code_sha256":"0038fdaca6e5a360bb4a2721d86a18b7cfb4906f4929915b662c938b3983db70","comparison":{"oracle_origin":"independent documentation expectation; not derived from consumer output","passed":true,"scope":"latest confirmed sample"},"compiler":{"diagnostic":null,"status":"compiled"},"context_hash":"cbcf0b1c7f6da72b888e476c57cbbf12b18fc69df5508934bf2a7f04ae4b8a93","data":{"dataset_policy":"Available chart history; full vendor market data excluded from export. Exact observed outputs and aggregates retained; reproduction needs the same vendor dataset.","last_bar_time":1792422000000,"session":"regular trading hours","symbol":"RUS:USDRUB_TOM","timeframe":"60","timezone":"UTC"},"date":"2026-10-20T00:13:41.422Z","definition_hash":"0633e6030a1f9f69f4278771ac094f98bb7c12a70308a7e6a2f3c2e5de13ef19","definition_id":"probe.audit.line-wrapping","environment":{"build":"web 2026-10-20; vendor build identifier not exposed","implementation":"TradingView Pine Editor","mode":"historical confirmed; market closed"},"language_version":6,"parameters":{"chart_type":"standard candles","market":"closed","script_inputs":"defaults"},"run_id":"run.tradingview.line-wrapping.20261020","runtime":{"observed":{"histogram_latest_display":0.0075,"tuple_and_parenthesis_wrapping":"compiled and executed"},"reason":null,"status":"executed"},"screenshot":"spec/run-artifacts/line-wrapping.jpg"}
