{"artifact":"spec/run-artifacts/footprint.json","attachments":[{"path":"spec/run-artifacts/footprint.jpg","sha256":"96f4ff0b7375ab19d1f3d641c8b678e5b1003d9235b8cce9b444656c4d9a53b7"}],"code_sha256":"6464d87029d632e4a10c62d1ee0319f087c12479dee3c7f5be6415752e90e97c","comparison":{"oracle_origin":"independent documentation expectation; not derived from consumer output","passed":null,"scope":"latest confirmed sample"},"compiler":{"diagnostic":null,"status":"compiled"},"context_hash":"cbcf0b1c7f6da72b888e476c57cbbf12b18fc69df5508934bf2a7f04ae4b8a93","data":{"dataset_policy":"Available chart history; full vendor market data excluded from export. Exact observed outputs and aggregates retained; reproduction needs the same vendor dataset.","last_bar_time":1792422000000,"session":"regular trading hours","symbol":"RUS:USDRUB_TOM","timeframe":"60","timezone":"UTC"},"date":"2026-10-20T00:16:23.141Z","definition_hash":"8625d9577a89da08ea55e15ef23c1f498b71b0ba44c085e270f8ef34fde825d6","definition_id":"probe.audit.footprint","environment":{"build":"web 2026-10-20; vendor build identifier not exposed","implementation":"TradingView Pine Editor","mode":"historical confirmed; market closed"},"language_version":6,"parameters":{"chart_type":"standard candles","market":"closed","script_inputs":"defaults"},"run_id":"run.tradingview.footprint.20261020","runtime":{"observed":{"diagnostic":"Error on bar 0: This script uses seconds-based timeframes, which are only available to users with Plus and higher-tier plans. at #main():4","runtime_error":"RE10063"},"reason":"TradingView RE10063: seconds-based data requires Plus or a higher-tier plan.","status":"blocked"},"screenshot":"spec/run-artifacts/footprint.jpg"}
