{"artifact":"spec/run-artifacts/audit6091-array-low-bound.json","code_sha256":"713a781a59056c4fde849085135a31824048955ee49d1888b60de4774422f31e","comparison":{"diagnostic":{"category":"LANGUAGE_INVALID","phase":"runtime","rule_id":"rule.array.index","source_span":{"column":6,"line":3}},"origin":"own_consumer_regression","passed":true},"compiler":{"diagnostic":null,"status":"compiled"},"context_hash":"502134098385be64e8f2bd5391d430842af3d72e26b09ed412d2906777a5cdf8","data":{"fixture":"spec/fixtures/context.json","sha256":"e9d64a394431632ec0723f7a830b36fa2304d91c0ce5c02cbe498f42005c96b6"},"date":"2026-10-20T17:01:13.993909+00:00","definition_hash":"f59de36623891da0124d48071420bea8fde70d14c22eb34729e8993d275a1b17","definition_id":"probe.audit6091.array-low-bound","environment":{"build":"4e6babf3f2cfe4b4791e2c001ac5afec0aae4da962aeb3ea45088ccc0e0acbd4","implementation":"Pine Wiki offline consumer regression","mode":"own synthetic historical fixture"},"language_version":6,"parameters":{},"run_id":"run.consumer.audit6091.array-low-bound.20261020","runtime":{"observed":{"category":"LANGUAGE_INVALID","decision_ref":"decision.rule.array.index.semantics","evidence_refs":["source.migration6","source.types"],"issue_refs":[],"message":"Array index out of range","phase":"runtime","reason":null,"rule_id":"rule.array.index","source_span":{"column":6,"end_column":15,"line":3}},"reason":"LANGUAGE_INVALID","status":"error"}}
