{"artifact":"spec/run-artifacts/lookahead-6.json","attachments":[],"code_sha256":"45ac3ffbaa4bc354e018bcd79a081124538c7dc06343a5962a8cb80701170b5a","comparison":{"oracle_origin":"independent documentation expectation; not derived from consumer output","passed":null,"scope":"Latest displayed sample; no exact tolerance proof without the separate aggregate predicate."},"compiler":{"diagnostic":null,"status":"compiled"},"context_hash":"cbcf0b1c7f6da72b888e476c57cbbf12b18fc69df5508934bf2a7f04ae4b8a93","data":{"dataset_policy":"Available chart history; full vendor market data excluded from export. Exact observed outputs and aggregates retained; reproduction needs the same vendor dataset.","last_bar_time":1792422000000,"session":"regular trading hours","symbol":"RUS:USDRUB_TOM","timeframe":"60","timezone":"UTC"},"date":"2026-10-20T00:13:35Z","definition_hash":"b95fa5239cb665e4d5f3cf517ba4fb5f66fba1ebceb7b4546ea5a856da3dd9bb","definition_id":"probe.audit.lookahead-6","environment":{"build":"web 2026-10-20; vendor build identifier not exposed","implementation":"TradingView Pine Editor","mode":"historical confirmed; market closed"},"language_version":6,"parameters":{"chart_type":"standard candles","market":"closed","script_inputs":"defaults"},"run_id":"run.tradingview.lookahead-6.20261020","runtime":{"observed":{"difference_latest_display":0},"reason":null,"status":"executed"}}
