{"artifact":"spec/run-artifacts/rsi-range.json","attachments":[{"path":"spec/run-artifacts/rsi-range.jpg","sha256":"2e365c8c8139a9314fc15cd00fe4a98c810c8c819ace91b13076987059122ad5"},{"path":"spec/run-artifacts/rsi-range.pine","sha256":"1a9ae3b8fcb34780efdb0d71d49ff9cbaf521e14e25db47960cbf6e0482a6dc6"}],"code_sha256":"1a9ae3b8fcb34780efdb0d71d49ff9cbaf521e14e25db47960cbf6e0482a6dc6","comparison":{"oracle_origin":"independent documentation expectation; not derived from consumer output","passed":null,"scope":"whole-history aggregate; numeric precision limited by chart display"},"compiler":{"diagnostic":null,"status":"compiled"},"context_hash":"b50c953d64670dc08c23d05eb7d86010d4f519fa0549d041652b5ab709b58e04","data":{"dataset_policy":"Available chart history; full vendor market data excluded from export. Exact observed outputs and aggregates retained; reproduction needs the same vendor dataset.","defined_bars":12900,"first_defined_time":1609747200000,"last_bar_time":1792422000000,"session":"regular trading hours","symbol":"RUS:USDRUB_TOM","timeframe":"60","timezone":"UTC"},"date":"2026-10-20T00:13:01.899Z","definition_hash":"27326c5b213e1186729d724fb1dc31ce98139d90fc0a9921f6e4a381f29454f3","definition_id":"probe.audit.rsi-contracts-range","environment":{"build":"web 2026-10-20; vendor build identifier not exposed","implementation":"TradingView Pine Editor","mode":"historical confirmed; market closed"},"language_version":4,"parameters":{"chart_type":"standard candles","market":"closed","script_inputs":"defaults"},"run_id":"run.tradingview.rsi-range.20261020","runtime":{"observed":{"defined_bars":12900,"first_defined_time":1609747200000,"last_time":1792422000000,"max_abs_error_display":0,"na_mismatches":0,"precision_limit":"Chart shows four decimal places; zero displayed maximum does not certify error below 1e-10."},"reason":null,"status":"executed"},"screenshot":"spec/run-artifacts/rsi-range.jpg"}
