{"artifact":"spec/run-artifacts/isin.json","attachments":[{"path":"spec/run-artifacts/isin.jpg","sha256":"a183509e92571c93f7f8ed8420f6c70146158ec6fe39339779f36f21f9ec0a90"}],"code_sha256":"3e82cba7d11e6d50fe206db00226beba1352776b0768b3f9d771774afa75fd40","comparison":{"oracle_origin":"independent documentation expectation; not derived from consumer output","passed":null,"scope":"latest confirmed sample"},"compiler":{"diagnostic":null,"status":"compiled"},"context_hash":"cbcf0b1c7f6da72b888e476c57cbbf12b18fc69df5508934bf2a7f04ae4b8a93","data":{"dataset_policy":"Available chart history; full vendor market data excluded from export. Exact observed outputs and aggregates retained; reproduction needs the same vendor dataset.","last_bar_time":1792422000000,"session":"regular trading hours","symbol":"RUS:USDRUB_TOM","timeframe":"60","timezone":"UTC"},"date":"2026-10-20T00:11:23.677Z","definition_hash":"efdd31db3da18d71c06d08c7eea6a79feda64bb66c7eeb727dcd39fb7aef3862","definition_id":"probe.audit.isin","environment":{"build":"web 2026-10-20; vendor build identifier not exposed","implementation":"TradingView Pine Editor","mode":"historical confirmed; market closed"},"language_version":6,"parameters":{"chart_type":"standard candles","market":"closed","script_inputs":"defaults"},"run_id":"run.tradingview.isin.20261020","runtime":{"observed":{"nonempty_isin":"not observed","table":"ISIN unavailable"},"reason":null,"status":"executed"},"screenshot":"spec/run-artifacts/isin.jpg"}
