{"artifact":"spec/run-artifacts/audit6091-array-high-bound.json","code_sha256":"ecd9f222e9b2e5a51fe35a7f3cdd1801d4696ea2da425c18f394a2536d7624e6","comparison":{"diagnostic":{"category":"LANGUAGE_INVALID","phase":"runtime","rule_id":"rule.array.index","source_span":{"column":6,"line":3}},"origin":"own_consumer_regression","passed":true},"compiler":{"diagnostic":null,"status":"compiled"},"context_hash":"502134098385be64e8f2bd5391d430842af3d72e26b09ed412d2906777a5cdf8","data":{"fixture":"spec/fixtures/context.json","sha256":"e9d64a394431632ec0723f7a830b36fa2304d91c0ce5c02cbe498f42005c96b6"},"date":"2026-10-20T17:01:14.054651+00:00","definition_hash":"2031889b13b8d11cf760c7ea7c49c0a5730b7237b7a564bdfea0d33c15ff6e8a","definition_id":"probe.audit6091.array-high-bound","environment":{"build":"4e6babf3f2cfe4b4791e2c001ac5afec0aae4da962aeb3ea45088ccc0e0acbd4","implementation":"Pine Wiki offline consumer regression","mode":"own synthetic historical fixture"},"language_version":6,"parameters":{},"run_id":"run.consumer.audit6091.array-high-bound.20261020","runtime":{"observed":{"category":"LANGUAGE_INVALID","decision_ref":"decision.rule.array.index.semantics","evidence_refs":["source.migration6","source.types"],"issue_refs":[],"message":"Array index out of range","phase":"runtime","reason":null,"rule_id":"rule.array.index","source_span":{"column":6,"end_column":15,"line":3}},"reason":"LANGUAGE_INVALID","status":"error"}}
