{"artifact":"spec/run-artifacts/switch-bool.json","attachments":[{"path":"spec/run-artifacts/switch-bool.jpg","sha256":"752840c52207e7c13f05f67d92c0f63e148e5f7020da599e716984fcc3e514b9"}],"code_sha256":"00d15cd49725b66a385766ec559e4a4025e3be04c22745320ceaf01c2e2e0d0c","comparison":{"oracle_origin":"independent documentation expectation; not derived from consumer output","passed":true,"scope":"latest confirmed sample"},"compiler":{"diagnostic":null,"status":"compiled"},"context_hash":"cbcf0b1c7f6da72b888e476c57cbbf12b18fc69df5508934bf2a7f04ae4b8a93","data":{"dataset_policy":"Available chart history; full vendor market data excluded from export. Exact observed outputs and aggregates retained; reproduction needs the same vendor dataset.","last_bar_time":1792422000000,"session":"regular trading hours","symbol":"RUS:USDRUB_TOM","timeframe":"60","timezone":"UTC"},"date":"2026-10-20T00:13:36.809Z","definition_hash":"4dd294006fc81099c4378d1d27b8a09ff286de5123539b7720d90f322b0fb865","definition_id":"probe.audit.switch-bool","environment":{"build":"web 2026-10-20; vendor build identifier not exposed","implementation":"TradingView Pine Editor","mode":"historical confirmed; market closed"},"language_version":6,"parameters":{"chart_type":"standard candles","market":"closed","script_inputs":"defaults"},"run_id":"run.tradingview.switch-bool.20261020","runtime":{"observed":{"plot":0,"selected":false},"reason":null,"status":"executed"},"screenshot":"spec/run-artifacts/switch-bool.jpg"}
