{"artifact":"spec/run-artifacts/audit6091-floor-modulo.json","code_sha256":"3a75b6fd2f6283c576cc0049e9fb4c5ab21a64ca89439c3949d7bf02c3e76740","comparison":{"origin":"own_consumer_regression","passed":true},"compiler":{"diagnostic":null,"status":"compiled"},"context_hash":"502134098385be64e8f2bd5391d430842af3d72e26b09ed412d2906777a5cdf8","data":{"fixture":"spec/fixtures/context.json","sha256":"e9d64a394431632ec0723f7a830b36fa2304d91c0ce5c02cbe498f42005c96b6"},"date":"2026-10-20T17:01:14.172504+00:00","definition_hash":"a4d947337c650ca78643dde588d5990dc4b890c8798d4369c4c7780b76fa42e9","definition_id":"probe.audit6091.floor-modulo","environment":{"build":"4e6babf3f2cfe4b4791e2c001ac5afec0aae4da962aeb3ea45088ccc0e0acbd4","implementation":"Pine Wiki offline consumer regression","mode":"own synthetic historical fixture"},"language_version":6,"parameters":{},"run_id":"run.consumer.audit6091.floor-modulo.20261020","runtime":{"observed":{"plots":{"value":[99,99,99,99]}},"reason":null,"status":"executed"}}
